{
 "schema_version": 1,
 "run_id": "run-3f9a1c2b7d4e",
 "slice_id": "core.relational.as_set.v1",
 "mode": "refactor",
 "base_sha": "7af5229e839f6fd50f2337c9733a4463c5fbdf64",
 "created_at": "2026-10-17T18:02:11Z",
 "updated_at": "2026-10-17T18:09:40Z",
 "budget": { "max_cost_usd": 1.5, "spent_usd": 0.0412, "unreported_roles": 0 },
 "stages": [
  { "id": "-1", "status": "skipped", "reason": "refactor mode without a configured golden master: the hermetic build and the baseline cover it, check", "artifact": null, "iterations": 0, "started_at": null, "finished_at": null },
  { "id": "0", "status": "done", "artifact": { "path": "intent.json", "sha256": "sha256:3a7bd3e2360a3d29eea436fcfb7e44c735d117c42d1c1835420b6b9942dd4f1b" }, "iterations": 0, "started_at": "2026-10-17T18:02:11Z", "finished_at": "2026-10-17T18:02:11Z" },
  { "id": "1", "status": "done", "artifact": { "path": "capture.json", "sha256": "sha256:b94d27b9934d3e08a52e52d7da7dabfac484efe37a5380ee9088f7ace2efcde9" }, "iterations": 0, "started_at": "2026-10-17T18:02:12Z", "finished_at": "2026-10-17T18:02:14Z" },
  { "id": "1.5", "status": "skipped", "reason": "refactor without pi_S relaxations: nothing to validate", "artifact": null, "iterations": 0, "started_at": null, "finished_at": null },
  { "id": "2", "status": "done", "artifact": { "path": "route.json", "sha256": "sha256:5feceb66ffc86f38d952786c6d696c79c2dbc239dd4e91b46729d73a27fb57e9" }, "iterations": 0, "started_at": "2026-10-17T18:02:14Z", "finished_at": "2026-10-17T18:02:14Z" },
  { "id": "3", "status": "skipped", "reason": "no builder_primary role in roles.json: the candidate is already in the tree", "artifact": null, "iterations": 0, "started_at": null, "finished_at": null },
  { "id": "4", "status": "running", "artifact": null, "iterations": 1, "started_at": "2026-10-17T18:02:15Z", "finished_at": null },
  { "id": "5", "status": "pending", "artifact": null, "iterations": 0, "started_at": null, "finished_at": null },
  { "id": "6", "status": "pending", "artifact": null, "iterations": 0, "started_at": null, "finished_at": null },
  { "id": "7", "status": "pending", "artifact": null, "iterations": 0, "started_at": null, "finished_at": null }
 ],
 "outcome": null
}
